{
 "bnapCases": 1,
 "area": "tlv",
 "title": "TLV streams, the even/odd rule, entry lists and base64url",
 "schema": "schema/tlv.schema.json",
 "generator": "conformance/gen_cases.py",
 "source": "spec/socket-draft-00.md (doc rev 39), spec/ERRATA.md, spec/DECISIONS.md, registry/generated/registry.json, reference/python/bnap_ref.py",
 "numberOfTests": 53,
 "header": [
  "TLV streams are BOLT 1 records with strictly increasing types (draft-00 section 2).",
  "A receiver MUST reject an unknown even type as MALFORMED and MUST ignore an unknown odd",
  "type. Nested streams use only 0-239, the experimental range and GREASE. Objects in the",
  "EvenOddRule group are complete and correctly signed, so the type is the only question."
 ],
 "notes": {
  "Valid": {
   "bugType": "BASIC",
   "description": "A well-formed input every implementation must accept."
  },
  "Order": {
   "bugType": "MALFORMED",
   "description": "Types not strictly increasing."
  },
  "Duplicate": {
   "bugType": "MALFORMED",
   "description": "The same type twice."
  },
  "Truncated": {
   "bugType": "MALFORMED",
   "description": "A length that runs past the end of the buffer."
  },
  "NonMinimal": {
   "bugType": "MALFORMED",
   "description": "A non-minimal BigSize for a type or a length."
  },
  "UnknownEven": {
   "bugType": "MALFORMED",
   "description": "An unknown even type."
  },
  "UnknownOdd": {
   "bugType": "BASIC",
   "description": "An unknown odd type, which a receiver ignores."
  },
  "Grease": {
   "bugType": "BASIC",
   "description": "A GREASE record: odd, 3,000,000,001 to 3,000,000,999."
  },
  "NestedRange": {
   "bugType": "EDGE",
   "description": "A nested record outside 0-239, experimental and GREASE. draft-00 says nested streams use only those ranges but names no error for an odd type outside them, so rejecting or ignoring it are both acceptable; bnap_conf rejects."
  },
  "Base64": {
   "bugType": "MALFORMED",
   "description": "Not canonical unpadded base64url."
  }
 },
 "testGroups": [
  {
   "type": "StreamParse",
   "section": "2",
   "description": "Parse a bare TLV stream.",
   "tests": [
    {
     "tcId": 1,
     "comment": "empty stream",
     "flags": [
      "Valid"
     ],
     "sections": [
      "2"
     ],
     "inputs": {
      "hex": ""
     },
     "result": "valid",
     "expected": {
      "records": []
     }
    },
    {
     "tcId": 2,
     "comment": "type 0, empty value",
     "flags": [
      "Valid"
     ],
     "sections": [
      "2"
     ],
     "inputs": {
      "hex": "0000"
     },
     "result": "valid",
     "expected": {
      "records": [
       [
        0,
        ""
       ]
      ]
     }
    },
    {
     "tcId": 3,
     "comment": "two records",
     "flags": [
      "Valid"
     ],
     "sections": [
      "2"
     ],
     "inputs": {
      "hex": "000101020100"
     },
     "result": "valid",
     "expected": {
      "records": [
       [
        0,
        "01"
       ],
       [
        2,
        "00"
       ]
      ]
     }
    },
    {
     "tcId": 4,
     "comment": "type 256 written as fd0100",
     "flags": [
      "Valid"
     ],
     "sections": [
      "2"
     ],
     "inputs": {
      "hex": "fd010003616263"
     },
     "result": "valid",
     "expected": {
      "records": [
       [
        256,
        "616263"
       ]
      ]
     }
    },
    {
     "tcId": 5,
     "comment": "type 253, empty value",
     "flags": [
      "Valid"
     ],
     "sections": [
      "2"
     ],
     "inputs": {
      "hex": "0001fffd00fd00"
     },
     "result": "valid",
     "expected": {
      "records": [
       [
        0,
        "ff"
       ],
       [
        253,
        ""
       ]
      ]
     }
    },
    {
     "tcId": 6,
     "comment": "type 1 after type 2",
     "flags": [
      "Order"
     ],
     "sections": [
      "2"
     ],
     "inputs": {
      "hex": "020101000101"
     },
     "result": "invalid",
     "error": "MALFORMED",
     "errorCode": 2
    },
    {
     "tcId": 7,
     "comment": "type 1 twice",
     "flags": [
      "Duplicate"
     ],
     "sections": [
      "2"
     ],
     "inputs": {
      "hex": "010100010100"
     },
     "result": "invalid",
     "error": "MALFORMED",
     "errorCode": 2
    },
    {
     "tcId": 8,
     "comment": "length 5, one byte left",
     "flags": [
      "Truncated"
     ],
     "sections": [
      "2"
     ],
     "inputs": {
      "hex": "000501"
     },
     "result": "invalid",
     "error": "MALFORMED",
     "errorCode": 2
    },
    {
     "tcId": 9,
     "comment": "type with no length",
     "flags": [
      "Truncated"
     ],
     "sections": [
      "2"
     ],
     "inputs": {
      "hex": "00"
     },
     "result": "invalid",
     "error": "MALFORMED",
     "errorCode": 2
    },
    {
     "tcId": 10,
     "comment": "type 252 in three bytes",
     "flags": [
      "NonMinimal"
     ],
     "sections": [
      "2"
     ],
     "inputs": {
      "hex": "fd00fc00"
     },
     "result": "invalid",
     "error": "MALFORMED",
     "errorCode": 2
    },
    {
     "tcId": 11,
     "comment": "length 1 in three bytes",
     "flags": [
      "NonMinimal"
     ],
     "sections": [
      "2"
     ],
     "inputs": {
      "hex": "00fd000100"
     },
     "result": "invalid",
     "error": "MALFORMED",
     "errorCode": 2
    },
    {
     "tcId": 12,
     "comment": "a type prefix with no value",
     "flags": [
      "Truncated"
     ],
     "sections": [
      "2"
     ],
     "inputs": {
      "hex": "0000fd"
     },
     "result": "invalid",
     "error": "MALFORMED",
     "errorCode": 2
    }
   ]
  },
  {
   "type": "EvenOddRule",
   "section": "2",
   "description": "Complete objects with one extra record; parse as the named object.",
   "tests": [
    {
     "tcId": 13,
     "comment": "offer: odd type 1001 (reserved for future socket fields)",
     "flags": [
      "UnknownOdd"
     ],
     "sections": [
      "2"
     ],
     "inputs": {
      "object": "offer",
      "hex": "00010102200c5c339b0fc7426f88736cda459f84cf13c7a58dad26de49d2987a155e1eaf960a046acb2d4c0e20b28dad5f717c5144bdb0aa6db94bb6c79afa9b8bd9bc84825a2c1baafe64add910100707070707070707070707070707070712232200187061796d656e743a6c696768746e696e672f6368617267650201150403736174f040e1a76c567efb21b1d7ab933a699d4f77abd152a44115bc2f8ee52294208f28670914502745d641833cc539c74d3e110a597f7cd9bb558b205b73e6280d389c06f220eccbf37dc46826e9a3a38c3e3a683e48057c3d6c275f035c9ffd48cb5e7282affd03e9020102"
     },
     "result": "valid"
    },
    {
     "tcId": 14,
     "comment": "offer: even type 1002",
     "flags": [
      "UnknownEven"
     ],
     "sections": [
      "2"
     ],
     "inputs": {
      "object": "offer",
      "hex": "00010102200c5c339b0fc7426f88736cda459f84cf13c7a58dad26de49d2987a155e1eaf960a046acb2d4c0e20b28dad5f717c5144bdb0aa6db94bb6c79afa9b8bd9bc84825a2c1baafe64add910100707070707070707070707070707070712232200187061796d656e743a6c696768746e696e672f6368617267650201150403736174f04079728f39e65f8505dafc3506df6c947b6f96711238727d88bba393f5e56e7ff74e4a09908bc7f886ba53e5a06ea09f69a2d932282d4904d0cb51a0962c06e8b7f220e2ebc7c7c4a1a29daaabc4c79f3b6c1c44c5eaa190751ad7df733db74b9baf84fd03ea020102"
     },
     "result": "invalid",
     "error": "MALFORMED",
     "errorCode": 2
    },
    {
     "tcId": 15,
     "comment": "offer: odd type 27 in the socket range",
     "flags": [
      "UnknownOdd"
     ],
     "sections": [
      "2"
     ],
     "inputs": {
      "object": "offer",
      "hex": "00010102200c5c339b0fc7426f88736cda459f84cf13c7a58dad26de49d2987a155e1eaf960a046acb2d4c0e20b28dad5f717c5144bdb0aa6db94bb6c79afa9b8bd9bc84825a2c1baafe64add910100707070707070707070707070707070712232200187061796d656e743a6c696768746e696e672f63686172676502011504037361741b020102f04046b4aa16517c5a8d9849dacfd0d6a1e8dc42b8ee6c7c7a9ab100c3058f21a541fcaf3e9cccc59290c32e9693b81f9ecf17b286b1cf7dd93c8df16af6d87e9133f220e996b9ff1f8511cf690c82e5e93ca97d48e97f9f44f017162f73f5387795aa83"
     },
     "result": "valid"
    },
    {
     "tcId": 16,
     "comment": "offer: even type 28 in the socket range",
     "flags": [
      "UnknownEven"
     ],
     "sections": [
      "2"
     ],
     "inputs": {
      "object": "offer",
      "hex": "00010102200c5c339b0fc7426f88736cda459f84cf13c7a58dad26de49d2987a155e1eaf960a046acb2d4c0e20b28dad5f717c5144bdb0aa6db94bb6c79afa9b8bd9bc84825a2c1baafe64add910100707070707070707070707070707070712232200187061796d656e743a6c696768746e696e672f63686172676502011504037361741c020102f040a095100fafb470a852f799f4915dfe581c3dfcb4f4d12321fd0504eed66499ea4448d30b9753703d8496759bdde5775ca031e76481f5bb75f78fa842857584c8f22086884245a6d75c323ce25983290843285bccb52e4258f58fd55ea0b5bca2ef66"
     },
     "result": "invalid",
     "error": "MALFORMED",
     "errorCode": 2
    },
    {
     "tcId": 17,
     "comment": "offer: odd type 241 in the signature range",
     "flags": [
      "UnknownOdd"
     ],
     "sections": [
      "2"
     ],
     "inputs": {
      "object": "offer",
      "hex": "00010102200c5c339b0fc7426f88736cda459f84cf13c7a58dad26de49d2987a155e1eaf960a046acb2d4c0e20b28dad5f717c5144bdb0aa6db94bb6c79afa9b8bd9bc84825a2c1baafe64add910100707070707070707070707070707070712232200187061796d656e743a6c696768746e696e672f6368617267650201150403736174f0401bf266a37e8e86e80dd18b3f6ac81c9271e47a309c4d0f5c5a0ba65cfc1a65b8da5228d9a5dd73e9fb6d70e32d3c603160d9f430ef6eb76e16c960c8cd5a5716f1020102f2207e50927c826fee25dd228aa2eed2df25707bdeb372bce9dd76de4f2c5faa74c9"
     },
     "result": "valid"
    },
    {
     "tcId": 18,
     "comment": "offer: even type 244 in the signature range",
     "flags": [
      "UnknownEven"
     ],
     "sections": [
      "2"
     ],
     "inputs": {
      "object": "offer",